{
  "artifact_refs": [
    "content/publish-packets/content-ops-001-azur-next-guide.json",
    "media/events/azurmenton-005-new-guide.json"
  ],
  "evidence_ref": "evidence/content-ops/content-ops-001-azur-next-guide.publish.evidence.json",
  "execution_mode": "DEEP",
  "id": "azurmenton-content_published-next-real-guide-shape",
  "media_event_candidate": "media/events/azurmenton-005-new-guide.json",
  "object": {
    "id": "next-real-guide-shape",
    "kind": "guide",
    "locator": "guide:next-real-guide-shape"
  },
  "origin": "HUMAN_INITIATED",
  "portfolio_effect": "NONE",
  "project": "azurmenton",
  "provenance": {
    "observed_at": "2026-08-10T08:29:11Z",
    "recorded_by": "CONTENT-OPS-001",
    "source_uri": null
  },
  "result": "CONDITIONAL_PASS",
  "schema_version": "v1",
  "timestamp": "2026-08-10T08:29:11Z",
  "type": "CONTENT_PUBLISHED",
  "validation_tier": "STANDARD"
}
