{
  "artifact_refs": [
    "content/publish-packets/content-ops-002-azur-fast-path.json",
    "media/events/azurmenton-005-new-guide.json"
  ],
  "evidence_ref": "evidence/content-ops/content-ops-002-azur-fast-path.publish.evidence.json",
  "execution_mode": "DEEP",
  "id": "azurmenton-content_published-placeholder-azur-guide-fast-path-validation",
  "media_event_candidate": "media/events/azurmenton-005-new-guide.json",
  "object": {
    "id": "placeholder-azur-guide-fast-path-validation",
    "kind": "guide",
    "locator": "guide:placeholder-azur-guide-fast-path-validation"
  },
  "origin": "HUMAN_INITIATED",
  "portfolio_effect": "NONE",
  "project": "azurmenton",
  "provenance": {
    "observed_at": "2026-08-10T08:55:53Z",
    "recorded_by": "CONTENT-OPS-002",
    "source_uri": null
  },
  "result": "CONDITIONAL_PASS",
  "schema_version": "v1",
  "timestamp": "2026-08-10T08:55:53Z",
  "type": "CONTENT_PUBLISHED",
  "validation_tier": "STANDARD"
}
