{
  "artifact_refs": [
    "content/publish-packets/content-ops-002-abvx-note-fast-path.json"
  ],
  "evidence_ref": "evidence/content-ops/content-ops-002-abvx-note-fast-path.publish.evidence.json",
  "execution_mode": "DEEP",
  "id": "abvxsite-content_published-placeholder-abvx-writing-fast-path-validation",
  "media_event_candidate": null,
  "object": {
    "id": "placeholder-abvx-writing-fast-path-validation",
    "kind": "note",
    "locator": "writing:placeholder-abvx-writing-fast-path-validation"
  },
  "origin": "HUMAN_INITIATED",
  "portfolio_effect": "NONE",
  "project": "abvxsite",
  "provenance": {
    "observed_at": "2026-08-10T09:10:06Z",
    "recorded_by": "CONTENT-OPS-002",
    "source_uri": null
  },
  "result": "CONDITIONAL_PASS",
  "schema_version": "v1",
  "timestamp": "2026-08-10T09:10:06Z",
  "type": "CONTENT_PUBLISHED",
  "validation_tier": "QUICK"
}
